{"schema":"csl.eval.fixture/v0.1","snapshot":"S7","epoch":7,"strings":["A","B","C"],"entities":[{"id":1,"kind":"METHOD","name_sid":0,"container":null},{"id":2,"kind":"METHOD","name_sid":1,"container":null},{"id":3,"kind":"METHOD","name_sid":2,"container":null}],"relations":[{"subject":1,"relation":"CALLS","object":2},{"subject":2,"relation":"CALLS","object":3}],"evidence":[{"proposition":1,"subject":1,"relation":"CALLS","object":2,"polarity":"POSITIVE","quality":"EXACT","freshness_epoch":7,"lineage":1},{"proposition":2,"subject":2,"relation":"CALLS","object":3,"polarity":"POSITIVE","quality":"EXACT","freshness_epoch":7,"lineage":1}]}
